用户名,会员,星级,评论,类型1,评论时间1,评论时间2,类型2,评论时间3,评论时间4
****l,,"<div class=""comment-star star1""></div>",包装这个样子，我也服了,,,,【热销爆款】水润保湿面膜,2019-11-22 10:31,
u***k,,"<div class=""comment-star star1""></div>",包装简陋，盒子都压扁了,水润保湿面膜10片,2018-01-30 09:53,,,,
o***p,,"<div class=""comment-star star1""></div>",压成这个样子，我也是醉了。,,,2018-08-25 12:07,水润保湿面膜10片,,
****r,,"<div class=""comment-star star1""></div>",这盒子都是坏的为点儿啥,水润保湿面膜10片,2018-03-01 20:09,,,,
骑***环,,"<div class=""comment-star star1""></div>",拿来都烂完了，包装全部烂完,水润保湿面膜,,,,,2018-12-14 20:32
****z,,"<div class=""comment-star star1""></div>",本商品寄过来无包装，零散装,水润保湿面膜10片,2018-06-23 19:06,,,,
****j,PLUS会员,"<div class=""comment-star star1""></div>",刚拿到就降价了，表示不满意,,,,水润保湿面膜,2019-03-02 20:35,
****9,PLUS会员,"<div class=""comment-star star1""></div>",没收到货，却已签收，什么情况？,水润保湿面膜10片,2017-07-24 14:07,,,,
惠***猫,PLUS会员,"<div class=""comment-star star1""></div>",标着159元3盒，但只寄了一盒,【热销爆款】水润保湿面膜,,,,,2019-11-30 09:08
****m,,"<div class=""comment-star star1""></div>",两盒的包装盒都是被拆开过的,水润保湿面膜10片,2018-08-13 21:02,,,,
****a,,"<div class=""comment-star star1""></div>",产品还不错，但是包装盒是坏的,水润保湿面膜10片,2018-03-06 11:53,,,,
空***喜,PLUS会员,"<div class=""comment-star star1""></div>",不像是正品的面膜，质量有点次。,水润保湿面膜10片,2017-08-15 11:29,,,,
****6,PLUS会员,"<div class=""comment-star star1""></div>",就这样寄给我了，擅自就给打开？,,,,水润保湿面膜,2019-09-03 18:23,
s***1,PLUS会员,"<div class=""comment-star star1""></div>",里面包装被压的不成样子了！！！！,,,,水润保湿面膜,2019-05-10 12:02,
u***2,,"<div class=""comment-star star1""></div>",包装都坏了，也没有送货上门?,水润保湿面膜10片,2017-07-20 20:25,,,,
****粉,PLUS会员,"<div class=""comment-star star1""></div>",物流不给力，发过来给弄丢了一件,水润保湿面膜10片,2018-06-16 09:47,,,,
u***x,,"<div class=""comment-star star1""></div>",我买的跟之前的不一样，不是正品,水润保湿面膜,,,,,2019-08-15 23:18
****r,PLUS会员,"<div class=""comment-star star1""></div>",跟以前买的不一样了，奇怪,水润保湿面膜,,,,,2019-07-29 09:10
Q***5,,"<div class=""comment-star star1""></div>",我都不想说，真的是够了,水润保湿面膜10片,2018-06-02 15:39,,,,
苦***呆,,"<div class=""comment-star star1""></div>",买了就降价还不能补差价…,水润保湿面膜,,,,,2019-05-19 11:01
_***妖,PLUS会员,"<div class=""comment-star star1""></div>",买了就降价，还不支持价格保护,【热销爆款】水润保湿面膜,,,,,2019-11-10 18:38
****b,PLUS会员,"<div class=""comment-star star1""></div>",刚买回来没用就降价啦,【热销爆款】水润保湿面膜10片,,,,,2020-05-11 00:07
****f,,"<div class=""comment-star star1""></div>",没有之前用的品质好了,水润保湿面膜,,,,,2019-04-16 15:18
a***9,,"<div class=""comment-star star1""></div>",包装外壳明显受损，物流不给力,,,2018-07-01 19:12,水润保湿面膜10片,,
x***0,PLUS会员,"<div class=""comment-star star1""></div>",用过的最不好用的面膜,水润保湿面膜,,,,,2019-10-18 23:02
****b,,"<div class=""comment-star star1""></div>",用完之后，明显觉得是假的,水润保湿面膜10片,2017-12-26 20:33,,,,
****a,,"<div class=""comment-star star1""></div>",昨天买的，今天降价，你是认真的吗？,【热销爆款】水润保湿面膜10片,,,,,2019-12-12 00:47
****x,,"<div class=""comment-star star1""></div>",我只想说是假的根本不是正品,水润保湿面膜,,,,,2018-11-29 21:24
s***Z,,"<div class=""comment-star star1""></div>",面膜不是特别好用，一般,水润保湿面膜10片,2018-01-31 22:39,,,,
汤***福,,"<div class=""comment-star star1""></div>",一点效果都没有，差差差,水润保湿面膜,,,,,2019-08-17 18:17
****B,,"<div class=""comment-star star1""></div>",跟从韩国买的不一样，感觉不是正品,水润保湿面膜10片,2017-06-27 19:29,,,,
1***p,PLUS会员,"<div class=""comment-star star1""></div>",凑合没有想象中那么好,水润保湿面膜,,,,,2018-10-21 23:17
创***靈,,"<div class=""comment-star star1""></div>",感觉一般，价格还贵不好,水润保湿面膜10片,2018-04-08 10:47,,,,
s***4,,"<div class=""comment-star star1""></div>",我是128买的，怎么现在49，我也是醉了,水润保湿面膜10片,2017-08-29 22:50,,,,
****s,,"<div class=""comment-star star1""></div>",这真的是正品么？？盒子都是破的,,,2018-05-10 12:10,水润保湿面膜10片,,
l***3,PLUS会员,"<div class=""comment-star star1""></div>",肯定是假的，和之前买过的差距太大,水润保湿面膜,,,,,2019-02-01 21:19
****j,,"<div class=""comment-star star1""></div>",这是怎么回事，刚收到全部是这样子,,,,水润保湿面膜,2019-04-11 22:18,
****u,,"<div class=""comment-star star1""></div>",售后服务差！不拿顾客的时间当回事！,水润保湿面膜10片,2017-12-03 12:11,,,,
****c,,"<div class=""comment-star star1""></div>",不是说买三盒有送赠送吗？,【热销爆款】水润保湿面膜10片,,,,,2020-05-11 10:01
****k,,"<div class=""comment-star star1""></div>",一点也不好用，感觉是假的,水润保湿面膜10片,2018-04-15 23:54,,,,
****m,,"<div class=""comment-star star1""></div>",一点都不补水怎么回事呢,水润保湿面膜10片,2018-05-23 07:30,,,,
****k,,"<div class=""comment-star star1""></div>",用过起了好多闭合粉刺！,水润保湿面膜,,,,,2018-11-01 10:42
j***A,,"<div class=""comment-star star1""></div>",刚买完就降价啊合适吗！,水润保湿面膜10片,2017-08-09 12:47,,,,
u***c,,"<div class=""comment-star star1""></div>",两盒没密封，一盒已经损坏,,,,水润保湿面膜,2018-11-06 21:35,
****n,,"<div class=""comment-star star1""></div>",还没用过，不知道好不好用,水润保湿面膜10片,2017-06-23 20:22,,,,
三***a,,"<div class=""comment-star star1""></div>",满减活动总是变来变去，又不补差价，,水润保湿面膜,,,,,2019-04-27 11:37
C***n,,"<div class=""comment-star star1""></div>",不好用，还那么贵，假的吧,水润保湿面膜,,,,,2018-12-08 10:27
****l,,"<div class=""comment-star star1""></div>",包装过于简陋，让我质疑产品可靠性？,,,,水润保湿面膜,2019-06-12 20:44,
1***p,PLUS会员,"<div class=""comment-star star1""></div>",刚买完到屈臣氏一看一样的东西69块,水润保湿面膜,,,,,2019-07-13 18:57
****f,,"<div class=""comment-star star1""></div>",不好用，没有评价那么好吗,水润保湿面膜10片,2017-12-09 09:20,,,,
u***b,,"<div class=""comment-star star1""></div>",您没有填写内容，默认好评,水润保湿面膜10片,2018-08-20 21:10,,,,
H***g,,"<div class=""comment-star star1""></div>",您没有填写内容，默认好评,水润保湿面膜10片,2018-09-09 18:59,,,,
Y***乀,,"<div class=""comment-star star1""></div>",假的跟以前用的不一样,水润保湿面膜10片,2017-11-16 22:10,,,,
w***k,PLUS会员,"<div class=""comment-star star1""></div>",速度很给力，就是包装有点不理想,,,2017-10-09 14:31,水润保湿面膜10片,,
****b,,"<div class=""comment-star star1""></div>",这面膜设计的大脸专用吧,水润保湿面膜,,,,,2019-08-23 20:58
u***j,,"<div class=""comment-star star1""></div>",您没有填写内容，默认好评,水润保湿面膜,,,,,2019-07-13 21:02
****I,,"<div class=""comment-star star1""></div>",您没有填写内容，默认好评,水润保湿面膜,,,,,2019-07-24 23:49
****m,,"<div class=""comment-star star1""></div>",用完脸上会长白色的痘痘,水润保湿面膜,,,,,2019-10-02 15:41
d***6,,"<div class=""comment-star star1""></div>",居然是一块干布，残次品,,,,【热销爆款】水润保湿面膜,2019-11-19 23:27,
x***g,PLUS会员,"<div class=""comment-star star1""></div>",一般，没有在韩国买的好用,水润保湿面膜10片,2018-03-26 22:18,,,,
****a,,"<div class=""comment-star star1""></div>",刚买完就降价，你咋不早说,水润保湿面膜10片,2017-06-18 10:16,,,,
阔***宝,,"<div class=""comment-star star1""></div>",买过好多次了，这次的包装、全烂了,水润保湿面膜10片,2018-06-18 19:57,,,,
****b,,"<div class=""comment-star star1""></div>",假货，和我在屈臣氏买的不一样,【热销爆款】水润保湿面膜10片,,,,,2020-05-17 22:06
****4,,"<div class=""comment-star star1""></div>",收到货的时候是烂的客服不理,【热销爆款】水润保湿面膜,,,,,2019-11-12 09:05
****i,,"<div class=""comment-star star1""></div>",假货别买，有问题没人管！,水润保湿面膜10片,2018-06-03 22:12,,,,
u***V,,"<div class=""comment-star star1""></div>",第一次用，不是想要的效果！,水润保湿面膜10片,2018-03-01 14:47,,,,
z***3,,"<div class=""comment-star star1""></div>",广告打的179四盒，到手价186.9！自己看吧,,,,【热销爆款】水润保湿面膜,2019-11-11 13:31,
u***5,,"<div class=""comment-star star1""></div>",所有的盒子都被拆开，每盒都少了三张,水润保湿面膜10片,2017-11-01 10:47,,,,
u***w,PLUS会员,"<div class=""comment-star star1""></div>",盒损坏！！盒内面膜都散出,,,2018-03-04 22:09,水润保湿面膜10片,,
****z,PLUS会员,"<div class=""comment-star star1""></div>",京东的物流就是这个样子的，这么暴力,,,2017-11-17 12:07,水润保湿面膜10片,,
****b,PLUS会员,"<div class=""comment-star star1""></div>",跟家里用的完全不一样绝对不是正品,水润保湿面膜,,,,,2019-03-16 17:18
无***生,,"<div class=""comment-star star1""></div>",包装简陋，到了盒子全部是烂的。。。。,水润保湿面膜10片,2018-03-20 13:53,,,,
****p,,"<div class=""comment-star star1""></div>",嗯买三盒没有赠安瓶吗?,【热销爆款】水润保湿面膜10片,,,,,2020-05-06 18:00
拉***棍,,"<div class=""comment-star star1""></div>",补水效果不好。以后不敢买了,水润保湿面膜,,,,,2019-07-19 15:35
泉***子,,"<div class=""comment-star star1""></div>",发过来还有盒这个假货？,,,,水润保湿面膜,2018-12-29 21:47,
u***p,,"<div class=""comment-star star1""></div>",拿到货，四盒每盒有一端都开着。像假品！,【热销爆款】水润保湿面膜,,,,,2019-11-13 19:52
y***x,,"<div class=""comment-star star1""></div>",有假货，那个包装撕开的感觉都不一样,水润保湿面膜,,,,,2019-07-20 11:21
f***a,PLUS会员,"<div class=""comment-star star1""></div>",买了两盒，其中一盒的包装是拆开的,水润保湿面膜10片,2017-05-31 15:06,,,,
本***我,,"<div class=""comment-star star1""></div>",这一款还行胶原蛋白的过敏,【热销爆款】水润保湿面膜,,,,,2019-11-28 13:12
****2,,"<div class=""comment-star star1""></div>",包装破损，不知道是不是正品,,,,【热销爆款】水润保湿面膜10片,2020-05-16 14:39,
岚***6,PLUS会员,"<div class=""comment-star star1""></div>",假货，和我之前在北京买的不一样,【热销爆款】水润保湿面膜10片,,,,,2020-04-02 22:00
冰***熊,,"<div class=""comment-star star1""></div>",不是正品，还不让人说哦，卖*货***,水润保湿面膜10片,2017-07-08 13:14,,,,
刘***1,PLUS会员,"<div class=""comment-star star1""></div>",刚买完就降价10块，价保只给了1块钱,水润保湿面膜,,,,,2018-11-03 11:22
u***6,,"<div class=""comment-star star1""></div>",其他特色：敏感肌，慎买。花钱找罪受,【热销爆款】水润保湿面膜,,,,,2019-11-03 22:09
****e,,"<div class=""comment-star star1""></div>",补水效果：假的，跟之前买的不一样,水润保湿面膜,,,,,2019-10-20 23:55
****i,PLUS会员,"<div class=""comment-star star1""></div>",贴上之后脸上针扎的似的疼,【热销爆款】水润保湿面膜,,,,,2019-11-24 23:22
s***9,,"<div class=""comment-star star1""></div>",用过之后没有感觉皮肤水嫩,【热销爆款】水润保湿面膜10片,,,,,2019-12-14 23:43
****4,,"<div class=""comment-star star1""></div>",用了长痘，送来时盒子都坏了,水润保湿面膜10片,2018-09-09 22:52,,,,
A***恋,,"<div class=""comment-star star1""></div>",寄回来都压扁完了，都不用盒子装下,水润保湿面膜,,,,,2019-07-17 13:12
寻***-,PLUS会员,"<div class=""comment-star star1""></div>",刚买完就降价了还降了很多,水润保湿面膜10片,,,,,
u***r,,"<div class=""comment-star star1""></div>",盒子打开的！怎么运输也不至于全撕开吧,,,2017-12-13 12:20,水润保湿面膜10片,,
****p,PLUS会员,"<div class=""comment-star star1""></div>",东西还没收到，不知道怎么就确认收货了,水润保湿面膜10片,2017-07-12 21:32,,,,
夹***盗,PLUS会员,"<div class=""comment-star star1""></div>",包装不负责任，到货打开盒子都散了。,,,2017-08-06 12:35,水润保湿面膜10片,,
酷***惹,,"<div class=""comment-star star1""></div>",才买就降价，服了，还是厚的，,,,2017-09-12 22:53,水润保湿面膜10片,,
****0,,"<div class=""comment-star star1""></div>",包装都是坏了的而且跟之前买的不一样,,,2017-11-13 21:24,水润保湿面膜10片,,
Y***a,PLUS会员,"<div class=""comment-star star1""></div>",京东送过来的竟然这个样子可以投诉吗,,,2017-10-16 20:07,水润保湿面膜10片,,
陈***英,,"<div class=""comment-star star1""></div>",包装破损，无法安心放心使用……,,,2018-06-20 17:18,水润保湿面膜10片,,
x***9,PLUS会员,"<div class=""comment-star star1""></div>",送过来的封条都拆了换了两次都是这样,水润保湿面膜10片,2018-07-20 09:13,,,,
c***W,,"<div class=""comment-star star1""></div>",和我在韩国买的不一样，难道便宜没好货！,水润保湿面膜10片,2017-08-07 11:57,,,,
墨***泪,PLUS会员,"<div class=""comment-star star1""></div>",送过来盒子都破成这样了，怎么送人！,,,,【热销爆款】水润保湿面膜,2019-11-14 13:11,
s***2,PLUS会员,"<div class=""comment-star star1""></div>",用完满脸毛！假货！认证完毕！,水润保湿面膜,,,,,2018-12-14 11:55
晴***符,PLUS会员,"<div class=""comment-star star1""></div>",不好，不是正品，是国内生产的，不是韩国的,水润保湿面膜10片,2017-11-28 14:06,,,,
半***香,PLUS会员,"<div class=""comment-star star1""></div>",还没有，别人的评价蛮高的，下次再来评价,水润保湿面膜,,,,,2019-05-24 21:07
Z***1,,"<div class=""comment-star star1""></div>",没包装膜外包装贼旧是真是假你们猜,水润保湿面膜10片,2017-10-16 22:19,,,,
D***C,PLUS会员,"<div class=""comment-star star1""></div>",感觉没之前做的好用了。。。。,水润保湿面膜,,,,,2019-06-05 13:53
****d,,"<div class=""comment-star star1""></div>",不是正品，用了皮肤粘乎乎的,水润保湿面膜10片,2017-08-13 22:32,,,,
****m,,"<div class=""comment-star star1""></div>",买了一天，还没开始用，又降价了，。。。。。。。。。。。。。,水润保湿面膜10片,2017-11-09 18:07,,,,
雨***默,PLUS会员,"<div class=""comment-star star1""></div>",降价不爽，面膜有点厚，其他没啥,水润保湿面膜,,,,,2018-10-19 06:49
****2,,"<div class=""comment-star star1""></div>",拿到手盒子是破的，感觉不太好~,水润保湿面膜,,,,,2018-11-15 20:18
刘***读,,"<div class=""comment-star star1""></div>",面膜一般般，不像宣传的那么好。,水润保湿面膜,,,,,2018-12-12 20:01
英***猫,,"<div class=""comment-star star1""></div>",水货，一股酒精味，跟以前不一样,【热销爆款】水润保湿面膜,,,,,2019-11-25 10:13
我***-,,"<div class=""comment-star star1""></div>",包装不好是真的，厚也是真的。,,,2018-07-21 16:07,水润保湿面膜10片,,
****0,,"<div class=""comment-star star1""></div>",收到的面膜包装破损，希望面膜是正品,,,2017-11-12 20:32,水润保湿面膜10片,,
江***森,PLUS会员,"<div class=""comment-star star1""></div>",这次买的感觉不对劲啊有点水吧,水润保湿面膜,,,,,2018-11-13 02:49
****d,,"<div class=""comment-star star1""></div>",假货没有的美迪惠尔的水印,,,2018-06-24 12:30,水润保湿面膜10片,,
刘***6,,"<div class=""comment-star star1""></div>",给老婆买的刚买了就搞活动好尴尬,水润保湿面膜10片,2017-09-24 07:29,,,,
****S,,"<div class=""comment-star star1""></div>",使用感受：假的，跟以前用的不一样。,【热销爆款】水润保湿面膜,,,,,2019-11-13 22:36
小***3,,"<div class=""comment-star star1""></div>",京东的包装能再差点吗，寄过来都是瘪的！！,,,2018-05-08 22:06,水润保湿面膜10片,,
****n,,"<div class=""comment-star star1""></div>",感觉假货，敷完出现搓泥的感觉,水润保湿面膜10片,2017-11-17 20:30,,,,
a***h,,"<div class=""comment-star star1""></div>",东西包装不错，效果不怎么好。,水润保湿面膜10片,2017-08-25 21:33,,,,
****i,,"<div class=""comment-star star1""></div>",面膜居然有破的，京东怎么了！？,水润保湿面膜,,,,,2019-09-13 21:34
****j,,"<div class=""comment-star star1""></div>",这个盒子我真的不想说什么了,,,,水润保湿面膜,2018-12-17 10:10,
****2,,"<div class=""comment-star star1""></div>",这次买的像假货，特意敷了过来评价的,水润保湿面膜,,,,,2019-06-19 12:52
****r,,"<div class=""comment-star star1""></div>",用了一次就过敏半个月还没好,水润保湿面膜10片,,,,,
****6,,"<div class=""comment-star star1""></div>",订五盒只寄一盒，无法沟通！,【热销爆款】水润保湿面膜10片,,,,,2020-02-13 21:12
****k,,"<div class=""comment-star star1""></div>",没有之前用的老款好用太稀薄,,,,水润保湿面膜,2019-10-06 19:21,
****8,,"<div class=""comment-star star1""></div>",第一次见到这么简陋的包装，我也是醉了！！,,,,水润保湿面膜,2019-03-20 21:33,
****j,,"<div class=""comment-star star1""></div>",有点小盖不住脸其他的还可以,水润保湿面膜10片,2017-11-09 04:12,,,,
缘***浅,,"<div class=""comment-star star1""></div>",货拿过来就是这样，货也不知道是不是真的,,,2017-06-20 13:41,水润保湿面膜10片,,
****p,,"<div class=""comment-star star1""></div>",面膜还没用，打开发现包装破损,,,2017-11-14 09:36,水润保湿面膜10片,,
A***湖,,"<div class=""comment-star star1""></div>",用了没什么效果还这么贵,【热销爆款】水润保湿面膜10片,,,,,2020-04-01 20:51
****r,,"<div class=""comment-star star1""></div>",您没有填写内容，默认好评,【热销爆款】水润保湿面膜10片,,,,,2020-03-21 21:08
x***p,,"<div class=""comment-star star1""></div>",确定正品吗？比正常的小很多。,水润保湿面膜,,,,,2018-10-02 22:40
l***U,,"<div class=""comment-star star1""></div>",还没用，但是盒子都破损了,,,,【热销爆款】水润保湿面膜10片,2020-02-16 20:05,
樱***1,PLUS会员,"<div class=""comment-star star1""></div>",脸都敷不上精华也有点少,,,,【热销爆款】水润保湿面膜,2020-06-07 21:57,
u***w,,"<div class=""comment-star star1""></div>",液体少的可怜，和韩国买的不一样,水润保湿面膜10片,2017-06-23 15:07,,,,
****2,,"<div class=""comment-star star1""></div>",用了以后脸上发红发烫。过敏了,【热销爆款】水润保湿面膜,,,,,2019-11-14 21:13
u***j,,"<div class=""comment-star star1""></div>",无感～包装坏了不会有下一次了,,,2018-05-07 14:37,水润保湿面膜10片,,
h***6,PLUS会员,"<div class=""comment-star star1""></div>",为什么盒子都是拆开的，有一种赝品的感觉,水润保湿面膜10片,2018-06-18 22:33,,,,
u***g,,"<div class=""comment-star star1""></div>",不知道怎么样包装来时是坏的,,,2017-12-11 09:44,水润保湿面膜10片,,
u***b,,"<div class=""comment-star star1""></div>",用完脸上黏黏的，不清爽,水润保湿面膜10片,2017-06-30 20:59,,,,
u***g,,"<div class=""comment-star star1""></div>",这不是正品！卸载京东，脸上过敏,水润保湿面膜10片,2017-06-24 23:32,,,,
燕***i,PLUS会员,"<div class=""comment-star star1""></div>",有拆过痕迹，怀疑被掉包了，,,,,【热销爆款】水润保湿面膜10片,2020-05-20 18:28,
****?,,"<div class=""comment-star star1""></div>",差劲，每批材质和大小都不一样,水润保湿面膜,,,,,2019-02-26 15:40
u***b,PLUS会员,"<div class=""comment-star star1""></div>",还没用，不知有没有效果,,,2017-11-04 10:54,水润保湿面膜10片,,
****b,,"<div class=""comment-star star1""></div>",感觉是假的，敷了没有任何效果，不建议购买,【热销爆款】水润保湿面膜,,,,,2019-11-08 16:34
****n,,"<div class=""comment-star star1""></div>",第一次买都不会过敏，这次买大过敏到吐血,【热销爆款】水润保湿面膜,,,,,2019-11-07 21:20
****b,,"<div class=""comment-star star1""></div>",用了一贴，感觉不怎么样,水润保湿面膜10片,2018-06-04 10:45,,,,
****5,,"<div class=""comment-star star1""></div>",这一次买的面膜又黄又薄，没有上次买的好,水润保湿面膜,,,,,2019-06-10 22:25
****2,,"<div class=""comment-star star1""></div>",一般，感觉实质没啥效果倒是发货速度很快,水润保湿面膜10片,2017-09-13 14:48,,,,
****i,,"<div class=""comment-star star1""></div>",商家优惠活动各种耍猴,【热销爆款】水润保湿面膜,2020-06-20 12:03,,,,
u***4,PLUS会员,"<div class=""comment-star star1""></div>",这包装都破了，这还敢敷脸上吗,,,2017-08-31 11:27,水润保湿面膜10片,,
****E,,"<div class=""comment-star star1""></div>",不怎么样...春雨比这个好些,【热销爆款】水润保湿面膜10片,,,,,2020-01-11 12:44
I***续,PLUS会员,"<div class=""comment-star star1""></div>",买了不到一星期就降价,水润保湿面膜10片,2017-06-10 20:19,,,,
平***灵,,"<div class=""comment-star star1""></div>",包装全都扁掉了，丑死了,,,2016-06-28 17:23,针剂水库补水保湿面膜25ml*10,,
我***婷,,"<div class=""comment-star star1""></div>",收到之后惊呆了。直接看图说话吧,,,2017-11-02 21:05,水润保湿面膜10片,,
Y***G,PLUS会员,"<div class=""comment-star star1""></div>",坑，和实体店买的不一样，里面这回是还有字,,,,水润保湿面膜,2019-05-18 16:02,
D***2,PLUS会员,"<div class=""comment-star star1""></div>",买完就降价了郁闷郁闷,水润保湿面膜10片,,,,,
笑***妈,PLUS会员,"<div class=""comment-star star1""></div>",盒子都这样了怎么送人？,,,2016-06-09 11:22,针剂水库补水保湿面膜25ml*10,,
****菜,PLUS会员,"<div class=""comment-star star1""></div>",为什么是打开的？盒子中间贴的什么给撕了？,,,2018-05-20 14:47,水润保湿面膜10片,,
****c,PLUS会员,"<div class=""comment-star star1""></div>",一般般也就那样不知道是不是正品,【热销爆款】水润保湿面膜10片,,,,,2020-03-17 21:26
****6,,"<div class=""comment-star star1""></div>",包装全坏了，面膜从盒里出来了,水润保湿面膜10片,2017-11-13 12:05,,,,
****d,,"<div class=""comment-star star1""></div>",只是会拿京豆忽悠人，要评价，然后呢？京豆呢？,【热销爆款】水润保湿面膜,,,,,2019-11-10 08:32
****b,PLUS会员,"<div class=""comment-star star1""></div>",就一个塑料袋包装，坏了,,,2017-09-01 22:26,水润保湿面膜10片,,
秀***晴,PLUS会员,"<div class=""comment-star star1""></div>",买回来就是拆开的，为什么？让我怎么还敢用.,,,2018-03-18 14:26,水润保湿面膜10片,,
u***3,,"<div class=""comment-star star1""></div>",才买一天就降价，不开心,水润保湿面膜10片,2018-03-09 23:04,,,,
周***日,,"<div class=""comment-star star1""></div>",是真的吗，包装这么简陋,,,2018-08-01 17:51,水润保湿面膜10片,,
****y,,"<div class=""comment-star star1""></div>",一般般，收到货，包装都坏了.感觉像退货.,,,,水润保湿面膜,2019-08-23 08:36,
u***a,,"<div class=""comment-star star1""></div>",搞什么啊，感觉不是正品,,,2018-09-17 13:41,水润保湿面膜10片,,
****d,,"<div class=""comment-star star1""></div>",假的，跟在韩国买的不一样,水润保湿面膜10片,2017-12-14 21:24,,,,
_***神,,"<div class=""comment-star star1""></div>",用到一半，发现，有一个漏袋，干了。,,,2017-06-13 09:16,水润保湿面膜10片,,
雄***A,,"<div class=""comment-star star1""></div>",刚买到手就降价，3月8日退的货，至今款未到账,水润保湿面膜10片,,,,,
****i,,"<div class=""comment-star star1""></div>",收到包装居然是打开的？,,,2018-05-08 14:20,水润保湿面膜10片,,
u***8,,"<div class=""comment-star star1""></div>",价格差不多吧，没啥优惠,【补水保湿】水润面膜,2020-11-13 15:32,,,,
大***漫,,"<div class=""comment-star star1""></div>",用完脸特别干，和韩国买的不一样。,水润保湿面膜10片,,,,,
****6,PLUS会员,"<div class=""comment-star star1""></div>",京东服务恶劣，远离京东,水润保湿面膜,,,,,2019-06-18 21:53
u***t,,"<div class=""comment-star star1""></div>",用完脸上起痘，怀疑是假的,【热销爆款】水润保湿面膜10片,,,,,2020-05-07 10:49
R***n,,"<div class=""comment-star star1""></div>",包装都拆开了还少了一片,水润保湿面膜10片,,,,,
****b,,"<div class=""comment-star star1""></div>",降价太快，东西是不是正品，都不敢确认了,水润保湿面膜10片,2016-08-27 19:45,,,,
****4,,"<div class=""comment-star star1""></div>",最后这次买的感觉有点假,水润保湿面膜10片,2018-01-02 00:27,,,,
