用户名,会员,星级,评论,类型1,评论时间1,评论时间2,类型2,评论时间3,评论时间4
****j,PLUS会员,"<div class=""comment-star star1""></div>",感觉是假的！用了脸泛红，不舒服！,【热销爆款】水润保湿面膜10片,,,,,2020-03-01 00:30
****w,,"<div class=""comment-star star1""></div>",包装简陋，不知道是不是正品,【玄彬同款】水润面膜,2021-04-19 12:28,,,,
霸***然,,"<div class=""comment-star star1""></div>",补水的居然这么油面膜还小JH,水润保湿面膜,,,,,2019-04-23 22:15
疯***6,,"<div class=""comment-star star1""></div>",一直相信京东，昨天刚用，今天就发痒红肿，到现在还没下下来。,水润保湿面膜10片,2018-03-21 21:29,,,,
****9,,"<div class=""comment-star star1""></div>",不好用，一点效果都没有,【补水保湿】水润面膜,2020-11-30 21:21,,,,
2***5,,"<div class=""comment-star star1""></div>",才买第二天就降价，还有一盒都没有到亏好多买了三盒,水润保湿面膜10片,2017-07-20 15:46,,,,
宝***8,,"<div class=""comment-star star1""></div>",昨天买的，今天就降价降了几十，再也不在京东买东西了，呵呵,,,,水润保湿面膜,2018-12-14 17:38,
****h,,"<div class=""comment-star star1""></div>",不知道是不是真品，但是我用着过敏,,,2018-01-26 13:07,水润保湿面膜10片,,
郭***文,,"<div class=""comment-star star1""></div>",面膜用着没效果啊，感觉是假的，大家别买了,水润保湿面膜10片,,,,,
****y,,"<div class=""comment-star star1""></div>",写着套装勿拆却是拆开的，还能怎么说,,,2016-05-27 09:27,针剂水库补水保湿面膜25ml*10,,
g***9,PLUS会员,"<div class=""comment-star star1""></div>",补水效果：一般了，总之没有之前好了！！！,【补水保湿】水润面膜,2020-10-02 22:19,,,,
1***y,,"<div class=""comment-star star1""></div>",买了两个不一样的，送来包装盒都是开的，这是什么情况,,,2018-06-11 10:54,水润保湿面膜10片,,
****c,,"<div class=""comment-star star1""></div>",买来送人的，但是过期了过期了过期了！,水润保湿面膜10片,2018-01-23 16:46,,,,
****e,,"<div class=""comment-star star1""></div>",为什么一拿到就开过了？给个解释,,,2021-06-02 19:28,【玄彬同款】水润面膜,,
果***8,,"<div class=""comment-star star1""></div>",膜很粗糙很厚，没有以前用的质量好,水润保湿面膜10片,2017-12-12 20:40,,,,
****9,,"<div class=""comment-star star1""></div>",牌子的包装都这么简陋，寄到的时候外包装已经破损了。,,,,水润保湿面膜,2019-07-27 15:01,
l***o,PLUS会员,"<div class=""comment-star star1""></div>",包装都是这样的不知道是不是正品一拿面膜都出来了,,,,水润保湿面膜,2019-06-05 13:26,
初***冬,PLUS会员,"<div class=""comment-star star1""></div>",就是随便拿个产品盒给我装10片，干脆给10片散装算了。,水润保湿面膜,,,,,2019-08-05 13:07
h***8,,"<div class=""comment-star star1""></div>",感觉不咋好用，补水效果不咋样！,【热销爆款】水润保湿面膜10片,,,,,2020-03-20 19:23
L***N,,"<div class=""comment-star star1""></div>",用了之后过敏了，整个脸都肿起来了,水润保湿面膜10片,2018-07-17 14:28,,,,
段***明,,"<div class=""comment-star star1""></div>",***果然名不虚传穿哎…看得换了,,,,水润保湿面膜,2018-10-18 20:31,
****i,,"<div class=""comment-star star1""></div>",这么敷衍的么？里面的东西都出来了,,,2020-06-19 16:31,【热销爆款】水润保湿面膜,,
5***D,,"<div class=""comment-star star1""></div>",没有第一次买的好，觉得不咋样，好像假的，盒子也不一样,,,,水润保湿面膜,2019-09-24 13:28,
****6,,"<div class=""comment-star star1""></div>",和我以前用的不一样，感觉不是真的,水润保湿面膜,,,,,2019-05-12 09:51
****c,,"<div class=""comment-star star1""></div>",好像是假的，为什么送过来包装盒都是开的,【玄彬同款】水润面膜,2020-12-16 14:41,,,,
梦***_,,"<div class=""comment-star star1""></div>",包装是坏的上面是密封的下面已经破损了,,,2018-03-10 17:02,水润保湿面膜10片,,
龙***门,,"<div class=""comment-star star1""></div>",买来送人，后来才发现120一袋，这价格两包绰绰有余！,水润保湿面膜10片,2017-11-17 15:36,,,,
s***y,PLUS会员,"<div class=""comment-star star1""></div>",为什么包装都是烂的，感觉让人偷龙转凤了。,水润保湿面膜10片,2018-01-12 20:41,,,,
****8,,"<div class=""comment-star star1""></div>",包装没有封口竟然还掉渣！！！！！！,水润保湿面膜,,,,,2019-08-06 20:49
****子,,"<div class=""comment-star star1""></div>",跟照片不符，无银色的贴，分明是拿50多的糊弄事！,水润保湿面膜10片,2016-11-28 14:52,,,,
森***y,,"<div class=""comment-star star1""></div>",产品质感：感觉升级款的面膜纸不是很好,水润保湿面膜,,,,,2019-10-25 11:33
A***苏,,"<div class=""comment-star star1""></div>",不好盒子被打开了面膜不知道用着什么样,水润保湿面膜10片,2017-09-14 19:20,,,,
H***U,,"<div class=""comment-star star1""></div>",买的时候收了邮费，现在为什么让知己去取？,水润保湿面膜10片,,,,,
1***s,,"<div class=""comment-star star1""></div>",呵呵，买回来两天，还没开始用，就给我从128，特价50多，降了一半多，呵呵,水润保湿面膜10片,2017-08-08 14:02,,,,
H***y,PLUS会员,"<div class=""comment-star star1""></div>",不好用，用了脸辣辣的，价格还不稳定,水润保湿面膜,,,,,2019-05-28 14:06
****V,,"<div class=""comment-star star1""></div>",和香港买的差好多，干干瘪瘪的，是@货来的吧,水润保湿面膜10片,2018-09-10 23:46,,,,
_***阿,,"<div class=""comment-star star1""></div>",产品质感：假货使用感受：假适合肤质：不知道补水效果：一般,水润保湿面膜,,,,,2019-09-15 12:38
u***n,,"<div class=""comment-star star1""></div>",生产日期比别人晚，生产批次比别人早！这是哪里来的混账逻辑,,,2018-08-29 14:35,水润保湿面膜10片,,
魏***爽,PLUS会员,"<div class=""comment-star star1""></div>",质量非常差应该不是正品含酒精大家不要上当,【补水保湿】水润面膜,2020-11-01 00:39,,,,
****a,,"<div class=""comment-star star1""></div>",面膜都干了！精华液在哪呢？,【热销爆款】水润保湿面膜,2020-06-26 21:24,,,,
****I,PLUS会员,"<div class=""comment-star star1""></div>",刚到货还没用，四盒全部查不到授权码，假不假我也不知道,,,,【热销爆款】水润保湿面膜10片,2020-02-13 11:57,
风***凉,PLUS会员,"<div class=""comment-star star1""></div>",不怎么好用，基本没效果。谁用谁上当。,水润保湿面膜10片,,,,,
3***.,,"<div class=""comment-star star1""></div>",jia货，不是真的，还敏感发布不了。期瞒消费者,水润保湿面膜10片,2017-06-28 07:41,,,,
****8,,"<div class=""comment-star star1""></div>",感觉是假货，包装简陋，跟官网上的不一样,水润保湿面膜10片,2016-08-11 14:45,,,,
1***p,PLUS会员,"<div class=""comment-star star1""></div>",一点不滋润后悔还办卡了,【玄彬同款】水润面膜,2021-03-29 10:39,,,,
****k,,"<div class=""comment-star star1""></div>",盒子有点破损，影响心情，收件地址也不对,,,,【热销爆款】水润保湿面膜10片,2020-01-12 08:54,
麦***曼,,"<div class=""comment-star star1""></div>",拆箱之后包装都是打开过的？什么意思联系客服也不管？,,,,水润保湿面膜,2019-08-06 19:30,
****e,,"<div class=""comment-star star1""></div>",面膜是假的，跟家里买的相同的牌子完全不一样！,【热销爆款】水润保湿面膜,2020-07-16 22:31,,,,
情***u,,"<div class=""comment-star star1""></div>",用了好久这个产品这次买来用了起满脸的红疙瘩确定是假货,水润保湿面膜,,,,,2019-09-29 13:50
l***k,PLUS会员,"<div class=""comment-star star1""></div>",收到还没用，怀疑中，因为盒子都烂了，脏乎乎的,,,,水润保湿面膜,2019-06-24 10:56,
a***7,PLUS会员,"<div class=""comment-star star1""></div>",快递都损坏了，里面的面膜都被开了,,,2021-06-03 15:55,【玄彬同款】水润面膜,,
u***y,,"<div class=""comment-star star1""></div>",送到外包装破损，里面产品都是散的，京东快递很京喜,,,,【热销爆款】水润保湿面膜,2019-11-12 16:53,
j***n,,"<div class=""comment-star star1""></div>",价格还是原价但是199买四保价都没办法，不高兴没空退就这吧,水润保湿面膜,,,,,2019-05-24 09:42
w***0,,"<div class=""comment-star star1""></div>",给人一种二手货的感觉，有开过的痕迹,,,2020-11-11 20:23,【补水保湿】水润面膜,,
****m,,"<div class=""comment-star star1""></div>",和以前买的不一样，没有多少精华液，怀疑假货,水润保湿面膜10片,2017-05-14 23:30,,,,
****0,PLUS会员,"<div class=""comment-star star1""></div>",没有退差价，刚到货的时候价格就变了，价格一直在变动,水润保湿面膜10片,,,,,
q***i,,"<div class=""comment-star star1""></div>",连里面的包装都是被拆过的这个商家有问题,,,2018-05-19 17:26,水润保湿面膜10片,,
u***m,,"<div class=""comment-star star1""></div>",货都不知道送那里去了，怎么评价，一个多星期了都没有理,水润保湿面膜10片,2018-03-06 22:50,,,,
丿***爱,,"<div class=""comment-star star1""></div>",这回买的为什么每次贴脸都红痒一块一块地，是不是假的,水润保湿面膜10片,2017-11-23 06:47,,,,
u***n,,"<div class=""comment-star star1""></div>",跟我在免税店买的没法比，一点都没那种感觉,水润保湿面膜,,,,,2019-08-27 00:13
王***主,PLUS会员,"<div class=""comment-star star1""></div>",跟上次买的不一样不一样不一样,水润保湿面膜10片,2016-09-07 09:47,,,,
****7,,"<div class=""comment-star star1""></div>",第一次碰到这样动物事情，买了四盒被拆开了3盒，,,,,水润保湿面膜,2019-06-09 12:53,
h***1,,"<div class=""comment-star star1""></div>",本来是要买来送好姐妹的，收到货变这样了根本送来出手,,,2018-04-25 09:21,水润保湿面膜10片,,
酷***厘,PLUS会员,"<div class=""comment-star star1""></div>",包装简陋，和别的东西放一起，就个快递盒子,水润保湿面膜,,,,,2019-02-17 16:59
****f,,"<div class=""comment-star star1""></div>",您没有填写内容，默认好评,【玄彬同款】水润面膜,2021-04-18 22:21,,,,
****u,,"<div class=""comment-star star1""></div>",使用感受：不好用，不是正品，物流倒是很快两天到了,【热销爆款】水润保湿面膜,,,,,2019-11-24 21:12
x***c,,"<div class=""comment-star star1""></div>",以前朋友从韩货代购过，跟以前用的完全不一样,水润保湿面膜10片,2017-11-17 22:02,,,,
****i,,"<div class=""comment-star star1""></div>",这个活动完全就是为了促销买来还有一个月就要过期了,【热销爆款】水润保湿面膜10片,,,,,2020-04-06 16:29
****i,,"<div class=""comment-star star1""></div>",和以前用的一点儿也不一样，不好用，,水润保湿面膜,,,,,2019-03-06 15:20
****e,,"<div class=""comment-star star1""></div>",使用感受：这款面膜真的有补水效果吗？好油啊。奔溃,,,,【热销爆款】水润保湿面膜,2019-11-17 20:42,
我***3,PLUS会员,"<div class=""comment-star star1""></div>",送货延迟，特意让快递员把两个货品打包一起，却没有打包。,水润保湿面膜10片,2017-11-14 10:24,,,,
****j,,"<div class=""comment-star star1""></div>",好用不好用不知道，反正面膜包装都破了,【热销爆款】水润保湿面膜10片,,,,,2020-05-03 19:00
W***Z,PLUS会员,"<div class=""comment-star star1""></div>",精华液很少和我之前买的明显不同,水润保湿面膜10片,2017-08-24 15:14,,,,
****R,,"<div class=""comment-star star1""></div>",不好用，感觉买了假货，用完也效果不好,水润保湿面膜10片,2017-04-28 15:01,,,,
我***泪,PLUS会员,"<div class=""comment-star star1""></div>",感觉有点不是正品，跟外面的包装颜色有点不一样……,水润保湿面膜,,,,,2019-10-14 19:08
****l,PLUS会员,"<div class=""comment-star star1""></div>",不喜欢这款_不太好用_但京东物流依旧给力,【热销爆款】水润保湿面膜10片,,,,,2020-03-13 22:41
w***0,PLUS会员,"<div class=""comment-star star1""></div>",一般般吧，不如上次好感觉,【玄彬同款】水润面膜,2021-06-16 17:42,,,,
****9,,"<div class=""comment-star star1""></div>",不是正品，假的……再也不买了,水润保湿面膜10片,,,,,
從***蠻,,"<div class=""comment-star star1""></div>",刚买完就发店铺优惠券…膈应人,【玄彬同款】水润面膜,2021-05-08 13:19,,,,
****q,,"<div class=""comment-star star1""></div>",618买的，特别便宜，但用了十几片没什么效果,水润保湿面膜10片,2017-07-05 15:19,,,,
****2,,"<div class=""comment-star star1""></div>",一点也不好用，补水效果超差,【玄彬同款】水润面膜,2020-12-10 17:00,,,,
****n,,"<div class=""comment-star star1""></div>",真的是假的，里面的精华几乎没有，计划退货,【热销爆款】水润保湿面膜,,,,,2019-11-17 08:40
t***5,PLUS会员,"<div class=""comment-star star1""></div>",说是效果不行，怀疑不是正品！,针剂水库补水保湿面膜25ml*10,2016-06-26 12:55,,,,
****x,,"<div class=""comment-star star1""></div>",一搓一层泥，什么东西呀，第一买面膜出现这种情况,,,2018-05-09 22:06,水润保湿面膜10片,,
那***孩,,"<div class=""comment-star star1""></div>",还没有那个约四封印好用，这个完全是炒得热,水润保湿面膜10片,2017-09-15 21:10,,,,
****u,,"<div class=""comment-star star1""></div>",一盒完整有条码，有二盒开过的，就像是散装的一样,,,2020-08-28 21:37,【补水保湿】水润面膜,,
1***p,,"<div class=""comment-star star1""></div>",面膜盒子超差，一打开外盒，面膜盒子都是烂的，觉得东西一点不值,水润保湿面膜10片,2017-10-15 08:11,,,,
淼***2,PLUS会员,"<div class=""comment-star star1""></div>",买早了，下次还是要等十一买！不能相信商家什么提前活动。一盒差*,水润保湿面膜10片,2016-11-11 15:18,,,,
只***说,,"<div class=""comment-star star1""></div>",我想说，是不是买的假货了，连个箱子都没有，就包个塑料袋,,,,水润保湿面膜,2018-12-15 15:02,
****3,,"<div class=""comment-star star1""></div>",面膜里面是破的怀疑不是正品！！！！,【补水保湿】水润面膜,2020-11-03 09:37,,,,
_***-,PLUS会员,"<div class=""comment-star star1""></div>",感觉这次买的像是假的嘎嘎厚………,水润保湿面膜10片,2018-01-18 21:21,,,,
****h,,"<div class=""comment-star star1""></div>",物流速度挺快的东西比想象中的差的好多也不知道效果怎么样,水润保湿面膜10片,,,,,
t***1,,"<div class=""comment-star star1""></div>",反正和在商场买的不一样，也不知道为什么,【热销爆款】水润保湿面膜10片,,,,,2019-12-30 09:56
****v,,"<div class=""comment-star star1""></div>",跟韩国买的不一样，没敢用，实力坑货,【热销爆款】水润保湿面膜10片,,,,,2020-06-04 08:37
沉***吸,PLUS会员,"<div class=""comment-star star1""></div>",二维码根本扫不出来买回来的时候包装都是破的,水润保湿面膜,,,,,2019-06-16 15:35
谦***S,,"<div class=""comment-star star1""></div>",包装越来越糊弄，三盒包装都破损，看着都生气,水润保湿面膜,,,,,2019-06-15 13:05
****T,PLUS会员,"<div class=""comment-star star1""></div>",用完一盒面膜没有一点效果，不是实体店的效果,水润保湿面膜10片,2017-07-28 08:54,,,,
F***8,,"<div class=""comment-star star1""></div>",不好，面膜厚不柔软，精华液少又稀，,水润保湿面膜,,,,,2019-09-04 19:39
u***y,,"<div class=""comment-star star1""></div>",使用感受：第一次用这么厚，水分这么少的面膜产品质感：捞,【热销爆款】水润保湿面膜,,,,,2019-11-12 21:08
小***灯,PLUS会员,"<div class=""comment-star star1""></div>",其他特色：买三盒，一盒被开封了，数量不少，对付用吧,【热销爆款】水润保湿面膜10片,,,,,2020-04-04 22:23
t***8,,"<div class=""comment-star star1""></div>",感觉是假货，没有我之前用的舒服，打折的不能信,水润保湿面膜,,,,,2019-02-06 14:39
s***6,,"<div class=""comment-star star1""></div>",不想过多评论，第一次买也是最后一次购买。也希望其他人不要买,水润保湿面膜,,,,,2018-12-04 21:37
m***r,PLUS会员,"<div class=""comment-star star1""></div>",包装拆过了，不知道为什么…,针剂水库补水保湿面膜25ml*10,2016-06-11 07:35,,,,
I***G,PLUS会员[试用],"<div class=""comment-star star1""></div>",用完脸会红，用从韩国带回来的就不会,,,,,,
V***h,,"<div class=""comment-star star1""></div>",质量不知道是不是正品，但是包装是真的差，就一个盒子,水润保湿面膜,,,,,2019-07-25 16:08
1***p,,"<div class=""comment-star star1""></div>",应该不是正品，用了脸过敏,【玄彬同款】水润面膜,2021-06-06 11:46,,,,
W***0,,"<div class=""comment-star star1""></div>",懒得拍对比图，以后绝不会在京东买任何化妆品,水润保湿面膜10片,2017-11-03 01:49,,,,
****I,,"<div class=""comment-star star1""></div>",擦亮眼镜再买吧浪费我的钱,【玄彬同款】水润面膜,2021-02-14 07:55,,,,
樱***坠,PLUS会员,"<div class=""comment-star star1""></div>",面膜和我朋友之前用的不一样，当买个教训了,水润保湿面膜10片,2017-10-24 23:37,,,,
****e,,"<div class=""comment-star star1""></div>",怎么说呢，感觉非正品，毕竟活动时买的，也没亏多少算了,水润保湿面膜10片,2017-10-16 23:53,,,,
****Z,,"<div class=""comment-star star1""></div>",一点也不好用面膜都是坏的,【玄彬同款】水润面膜,2021-01-08 21:26,,,,
哈***特,PLUS会员,"<div class=""comment-star star1""></div>",名声在外，但是实际效果不好,,,2021-01-02 22:45,【玄彬同款】水润面膜,,
****6,,"<div class=""comment-star star1""></div>",假的，和我从韩国带回来的不一样，面纸就不一样,水润保湿面膜10片,2017-05-18 16:56,,,,
u***7,,"<div class=""comment-star star1""></div>",面膜厚，包装差，价格贵，觉得不是正品，???,水润保湿面膜,,,,,2018-11-21 23:21
****0,,"<div class=""comment-star star1""></div>",打开快递面膜包装盒子裂开个口子像是被人打开了一样,,,2018-05-29 20:23,水润保湿面膜10片,,
精***3,PLUS会员,"<div class=""comment-star star1""></div>",盒子是破的，谁知道是不是正品，没法在京东上买护肤东西了,水润保湿面膜10片,2017-08-25 12:48,,,,
****a,,"<div class=""comment-star star1""></div>",啥情况？打开快递包裹，面膜的盒子是打开着的,水润保湿面膜10片,2018-06-04 22:20,,,,
M***x,PLUS会员,"<div class=""comment-star star1""></div>",精华非常少，几分钟就干了！,【热销爆款】水润保湿面膜,2020-07-11 17:14,,,,
****a,PLUS会员,"<div class=""comment-star star1""></div>",面膜跟屈臣氏不一样，使用后皮肤变差,水润保湿面膜,,,,,2019-04-28 16:21
l***5,,"<div class=""comment-star star1""></div>",产品有问题，和之前买的明显不一样感觉是假货,【热销爆款】水润保湿面膜,,,,,2019-11-17 12:45
****q,,"<div class=""comment-star star1""></div>",面膜和朋友从韩国带回来的不一样，不是正品,水润保湿面膜10片,2017-08-12 13:24,,,,
深***喵,,"<div class=""comment-star star1""></div>",跟我之前用的不一样，假的……,【热销爆款】水润保湿面膜10片,,,,,2019-12-15 22:26
l***李,,"<div class=""comment-star star1""></div>",刚买不到一周降价15元，154买的现在139。,【玄彬同款】水润面膜,2021-06-10 22:47,,,,
w***姐,,"<div class=""comment-star star1""></div>",产品质感：扫码查不到结果，不是正品。我在别家买的都可以查到。,水润保湿面膜,,,,,2019-09-23 15:23
****v,,"<div class=""comment-star star1""></div>",贴了居然过敏整个脸都红了,【玄彬同款】水润面膜,2021-04-11 19:39,,,,
萌***萌,PLUS会员,"<div class=""comment-star star1""></div>",刚签收就降价*心累，塞塞的，不知道第多少次买东西这样了。,水润保湿面膜10片,2017-10-13 19:28,,,,
成***欧,PLUS会员,"<div class=""comment-star star1""></div>",加入购物车一个价，结算的时候又涨了，临时涨价让人难接受。,水润保湿面膜10片,2017-11-12 13:34,,,,
****N,,"<div class=""comment-star star1""></div>",不咋滴补水效果没有不知道是真品不,【玄彬同款】水润面膜,2020-12-15 21:41,,,,
莉***袜,,"<div class=""comment-star star1""></div>",假的！！和之前买的不一样用了脸刺痛,水润保湿面膜10片,,,,,
****4,,"<div class=""comment-star star1""></div>",补水效果差，精华液少，感觉是假货,【热销爆款】水润保湿面膜10片,,,,,2020-05-19 14:05
****1,,"<div class=""comment-star star1""></div>",买四盒只收到三盒，推来推去都不知道找谁,,,,【热销爆款】水润保湿面膜10片,2020-03-01 15:00,
u***P,,"<div class=""comment-star star1""></div>",还好吧！就是包装太简单了，盒子都压扁了,水润保湿面膜10片,2016-09-11 16:34,,,,
涅***古,,"<div class=""comment-star star1""></div>",我用过敏，不知道别人怎么样,水润保湿面膜10片,2016-10-25 15:09,,,,
****h,,"<div class=""comment-star star1""></div>",我买了三盒！好久都不见发货我也理解，但是只给我发两盒是为什么？,,,2017-06-24 20:59,水润保湿面膜10片,,
徐***新,,"<div class=""comment-star star1""></div>",128块买的10片以为是好东西，今天一看价格就48块了，这东西估计也就那样。,水润保湿面膜10片,2018-06-01 14:03,,,,
u***y,,"<div class=""comment-star star1""></div>",包装好随便，收到货盒子都是瘪的，让我怀疑是不是正品。,,,2018-06-08 10:38,水润保湿面膜10片,,
****4,,"<div class=""comment-star star1""></div>",之前用过美迪惠尔，这次用这个感觉是假货！,【热销爆款】水润保湿面膜10片,,,,,2020-02-20 15:05
t***j,,"<div class=""comment-star star1""></div>",我要退货客服就不在线，你这样做下次谁还敢买你家的面膜！,水润保湿面膜10片,2017-05-08 08:06,,,,
k***3,,"<div class=""comment-star star1""></div>",果真一份价格一分货，不一样的。补水也没那么多,,,2017-08-10 19:04,水润保湿面膜10片,,
蒲***强,PLUS会员,"<div class=""comment-star star1""></div>",东西拍错了客服干嘛呢，永远不会回消息吗？,【热销爆款】水润保湿面膜10片,,,,,2020-03-17 22:03
邓***女,,"<div class=""comment-star star1""></div>",包装全部破的用着不放心建议不要拍,【补水保湿】水润面膜,2020-11-17 18:47,,,,
C***熏,,"<div class=""comment-star star1""></div>",产品质感：用了这么多次。这次就像白水一样,【玄彬同款】水润面膜,2021-06-02 15:16,,,,
u***j,,"<div class=""comment-star star1""></div>",不满意为什么包装是拆过的是不是假的还是拆了换的假面膜进去,水润保湿面膜10片,2018-01-07 11:54,,,,
****b,,"<div class=""comment-star star1""></div>",拿回来变成这样，产品质量不知道会不会有问题。,,,,水润保湿面膜,2018-11-12 22:09,
****2,,"<div class=""comment-star star1""></div>",客服服务态度差，不理我，也看不到生产日期，怀疑是三无产品,【热销爆款】水润保湿面膜,,,,,2019-11-11 16:45
****A,,"<div class=""comment-star star1""></div>",没有收到货每次都在买家没有收到货的情况下先把钱收了,水润保湿面膜,,,,,2019-05-03 07:41
特***普,,"<div class=""comment-star star1""></div>",我k，送人的东西，快递把盒子都给我压坏了，醉了，山炮快递,水润保湿面膜10片,2017-06-12 09:44,,,,
****a,,"<div class=""comment-star star1""></div>",用完就过敏了起了好几颗痘痘,【玄彬同款】水润面膜,2021-05-21 08:57,,,,
u***d,,"<div class=""comment-star star1""></div>",包装就坏了，心情瞬间就不好。女朋友就不想要了,,,2018-05-12 21:32,水润保湿面膜10片,,
****l,,"<div class=""comment-star star1""></div>",不好用，用了之后过敏，脸上长疙瘩,水润保湿面膜,,,,,2019-03-28 15:35
褚***星,,"<div class=""comment-star star1""></div>",用完脸上油油的，，而且补水效果也不好,水润保湿面膜10片,2017-12-09 16:00,,,,
****ヽ,,"<div class=""comment-star star1""></div>",收到的时候包装是这个样子的，都破掉掉，影响心情,,,2016-05-25 11:11,针剂水库补水保湿面膜25ml*10,,
u***5,,"<div class=""comment-star star1""></div>",之前一直用的这个牌子的这家的也是假的可以我无话可说,水润保湿面膜10片,2018-08-16 23:00,,,,
李***y,,"<div class=""comment-star star1""></div>",贴合效果：差，面膜太厚使用感受：补水效果差,【补水保湿】水润面膜,2020-11-22 14:09,,,,
****o,,"<div class=""comment-star star1""></div>",昨天收货今天降价说活动不同不存在差价买贵不存在差价吗？？？,水润保湿面膜10片,2017-01-11 16:31,,,,
M***宠,PLUS会员,"<div class=""comment-star star1""></div>",与上次竹炭面膜相比这次补水的面膜更厚一些、,水润保湿面膜10片,2017-08-14 11:43,,,,
****g,PLUS会员,"<div class=""comment-star star1""></div>",第一次买，就有一盒被拆过痕迹，我就呵呵了??,【热销爆款】水润保湿面膜,,,,,2019-11-11 21:48
****8,,"<div class=""comment-star star1""></div>",包装没以前的好，是不是觉得买的次数多了，就敷衍了事了,水润保湿面膜10片,2017-12-12 11:23,,,,
