用户名,会员,星级,评论,类型1,评论时间1,评论时间2,类型2,评论时间3,评论时间4
****5,,"<div class=""comment-star star1""></div>",为什么这次买的面膜，感觉和以往的不一样。好厚,水润保湿面膜10片,2017-12-15 01:10,,,,
****K,,"<div class=""comment-star star1""></div>",有点干没有什么水分不太好用,【热销爆款】水润保湿面膜10片,,,,,2020-01-03 13:29
****5,,"<div class=""comment-star star1""></div>",不好用不服贴还有香精味重,水润保湿面膜,,,,,2019-09-04 23:43
琟***良,,"<div class=""comment-star star1""></div>",贴完面膜，脸一堆油，还黏手,水润保湿面膜10片,2016-10-28 21:53,,,,
李***露,,"<div class=""comment-star star1""></div>",第一次京东买面膜相信也是最后一次……,,,2018-06-19 10:52,水润保湿面膜10片,,
a***4,,"<div class=""comment-star star1""></div>",没有对比就没有伤害，还是去香港买吧,水润保湿面膜10片,2018-03-03 23:21,,,,
y***n,PLUS会员,"<div class=""comment-star star1""></div>",为什么扫码，没有信息？怎么确定真伪？,水润保湿面膜10片,2016-10-20 12:59,,,,
****a,PLUS会员,"<div class=""comment-star star1""></div>",用了之后一点效果都没还是那么干,【热销爆款】水润保湿面膜10片,,,,,2020-02-23 08:45
u***b,,"<div class=""comment-star star1""></div>",用后脸红刺痛不会在用了,水润保湿面膜10片,2018-02-26 23:23,,,,
****c,,"<div class=""comment-star star1""></div>",不好用、用完完全没效果,【玄彬同款】水润面膜,2021-01-07 00:39,,,,
****j,,"<div class=""comment-star star1""></div>",刚到家盒子都坏掉了，面膜都散开的，还没有使用,,,,水润保湿面膜,2019-01-19 17:19,
u***f,,"<div class=""comment-star star1""></div>",面膜纸有些小，敷完之后手上有小颗粒,水润保湿面膜,,,,,2019-04-07 15:51
L***a,,"<div class=""comment-star star1""></div>",产品质感：厚，差使用感受：水分少的我以為我搞錯了,【热销爆款】水润保湿面膜,2020-06-13 22:29,,,,
****0,,"<div class=""comment-star star1""></div>",买了四盒都是2018年生产日期,,,2020-11-17 10:55,【补水保湿】水润面膜,,
****t,PLUS会员,"<div class=""comment-star star1""></div>",基本上每盒都被开封过，封口处透明胶还有手印,【热销爆款】水润保湿面膜10片,,,,,2020-05-24 14:13
****o,PLUS会员,"<div class=""comment-star star1""></div>",还没用。收到货就有点被打开的感觉。懒得换。,,,,水润保湿面膜,2019-03-02 17:49,
****t,,"<div class=""comment-star star1""></div>",跟实体店买的不一样撕开口子也不是一条直线,【热销爆款】水润保湿面膜10片,,,,,2019-12-26 19:00
苑***静,,"<div class=""comment-star star1""></div>",过敏了，相互推脱责任，没人受理,【玄彬同款】水润面膜,2021-03-23 22:40,,,,
郑***女,,"<div class=""comment-star star1""></div>",这一次买的商品有点失望面膜盒没有粘封,,,2020-11-10 22:26,【补水保湿】水润面膜,,
乌***跑,,"<div class=""comment-star star1""></div>",会闷痘痘，之前脸上很少有痘痘。,【补水保湿】水润面膜,2020-10-20 21:35,,,,
小***心,,"<div class=""comment-star star1""></div>",物流速度很快，可是这次从南宁发货，有两盒都是被拆过得痕迹。,,,,水润保湿面膜,2019-10-08 12:52,
****7,,"<div class=""comment-star star1""></div>",假的，但是没有不良反应，只是补水的一款普通面膜,水润保湿面膜10片,2017-01-13 09:50,,,,
****v,PLUS会员,"<div class=""comment-star star1""></div>",这个肯定是假的，今天才用，比在屈臣氏买的要厚！,水润保湿面膜10片,2018-06-30 00:00,,,,
m***m,PLUS会员,"<div class=""comment-star star1""></div>",贴过后，脸像糊了一层油，粘糊糊的。,水润保湿面膜,,,,,2019-01-26 22:48
u***i,,"<div class=""comment-star star1""></div>",感觉用着没有之前的好用，到了包装都是坏的,【热销爆款】水润保湿面膜10片,,,,,2020-03-14 15:42
****a,,"<div class=""comment-star star1""></div>",感觉不一样，不像以前用的感觉，差好多,水润保湿面膜,,,,,2019-01-31 08:43
m***e,PLUS会员,"<div class=""comment-star star1""></div>",放自提点未告知要给钱，1块钱比丰巢柜还贵。,【玄彬同款】水润面膜,2021-02-01 15:22,,,,
T***8,,"<div class=""comment-star star1""></div>",买回来都已经开封了而且里面还塞着小广告呵呵,水润保湿面膜,,,,,2019-07-30 21:30
I***e,,"<div class=""comment-star star1""></div>",怎么是打开的，是不是换@的进来，寄给我。还没见过新买的东西，包装是打开的。,水润保湿面膜10片,2018-09-07 17:59,,,,
****1,,"<div class=""comment-star star1""></div>",拿到的时候包装盒都是破的，第一感觉就不怎么好,水润保湿面膜10片,2018-05-29 22:49,,,,
唯***乐,PLUS会员,"<div class=""comment-star star1""></div>",买2盒，一盒明显被拆过，京东盒子完好，面膜包装损坏,,,2016-11-05 10:12,水润保湿面膜10片,,
J***-,,"<div class=""comment-star star1""></div>",第一次买感觉不是正品跟自己在韩国买的不一样～谨慎购买,水润保湿面膜10片,2017-06-05 22:15,,,,
天***丶,,"<div class=""comment-star star1""></div>",这个没办法给好评，前一天买128第二天就58，保价也没用，就是不退钱,水润保湿面膜10片,2017-05-12 09:14,,,,
虾***5,,"<div class=""comment-star star1""></div>",假货，跟我在商城买的不一样，用起来感觉都不一样,水润保湿面膜10片,2017-12-07 21:47,,,,
****p,,"<div class=""comment-star star1""></div>",这包装真的没谁了，我都怀疑他是不是真的，用了再来追评,,,2016-06-19 12:32,针剂水库补水保湿面膜25ml*10,,
****d,,"<div class=""comment-star star1""></div>",跟我朋友在韩国代购的不一样。。。。效果也没那么理想。,,,2016-12-31 23:18,水润保湿面膜10片,,
u***h,,"<div class=""comment-star star1""></div>",假货黑作坊制造的吧，精华少用了过敏起痘,【补水保湿】水润面膜,2020-11-23 21:21,,,,
黄***7,,"<div class=""comment-star star1""></div>",不滋润，以前用的感觉不一样很干,【补水保湿】水润面膜,2020-08-24 14:55,,,,
****l,,"<div class=""comment-star star1""></div>",不太满意这次的购物，感觉是假的。脸上有点痛的感觉。,水润保湿面膜10片,,,,,
狐***y,,"<div class=""comment-star star1""></div>",假货，不是正品，货到后包装全部压坏，破损，再不相信京东了,水润保湿面膜,,,,,2019-02-19 13:29
Q***S,PLUS会员,"<div class=""comment-star star1""></div>",18年的生产日期，这个就是促销的产品质量！,【补水保湿】水润面膜,2020-11-17 08:30,,,,
****o,,"<div class=""comment-star star1""></div>",效果很一般，敷完后脸还是有点干,【补水保湿】水润面膜,2020-11-04 23:21,,,,
****f,PLUS会员,"<div class=""comment-star star1""></div>",盒子明显是烂的，拆过的！套装勿拆都是打开的！不知道是不是假的！,针剂水库补水保湿面膜25ml*10,2016-05-30 11:22,,,,
****4,,"<div class=""comment-star star1""></div>",这次买的不会是假的吧用起来跟之前用的不一样,水润保湿面膜,,,,,2019-05-13 13:03
纽***妮,,"<div class=""comment-star star1""></div>",不好用，和之前代购的不一样，不补水,水润保湿面膜10片,2018-03-26 08:58,,,,
D***8,PLUS会员,"<div class=""comment-star star1""></div>",有误导销售，与实物不相合，上面说159三盒，我下了两订单，收到货后两个单才两盒,,,,【热销爆款】水润保湿面膜,2019-11-28 09:45,
x***b,,"<div class=""comment-star star1""></div>",第一次买，和之前用的原装进口不一样，不是正品,水润保湿面膜10片,2017-06-04 23:36,,,,
尼***君,,"<div class=""comment-star star1""></div>",面膜都干的发白，这种面膜都拿出来卖？,【热销爆款】水润保湿面膜,,,,,2019-11-20 22:05
****颜,PLUS会员,"<div class=""comment-star star1""></div>",一般般，不够多精华液，用感不好,,,2020-10-08 06:38,【补水保湿】水润面膜,,
x***n,,"<div class=""comment-star star1""></div>",假货，和我一前在实体店买的不一样，以后买东西可要看清了,【补水保湿】水润面膜,2020-11-12 19:59,,,,
廖***睦,,"<div class=""comment-star star1""></div>",个人敷完，皮肤有刺痛感,【补水保湿】水润面膜,2020-11-01 22:39,,,,
u***3,PLUS会员,"<div class=""comment-star star1""></div>",我感觉是假货，贴了二十分钟，面膜上精化一点么有少,水润保湿面膜,,,,,2019-07-21 07:32
k***l,,"<div class=""comment-star star1""></div>",产品一般般，根本就没有什么补水效果，和矿泉水一样,水润保湿面膜10片,,,,,
S***千,PLUS会员,"<div class=""comment-star star1""></div>",用完感觉不舒服有点烂脸,【玄彬同款】水润面膜,2021-01-05 03:26,,,,
u***9,,"<div class=""comment-star star1""></div>",想购买此产品的注意，价格极不稳定，估计东西也一般,【热销爆款】水润保湿面膜,2020-06-19 13:50,,,,
****i,PLUS会员,"<div class=""comment-star star1""></div>",有点假，摸上给实体店感觉不一样,【玄彬同款】水润面膜,2021-04-09 14:18,,,,
l***儿,PLUS会员,"<div class=""comment-star star1""></div>",以前也买过这款还不错，但是这次买完贴了一次脸上长包了，不知道怎么回事,水润保湿面膜10片,2017-12-16 19:03,,,,
****0,PLUS会员,"<div class=""comment-star star1""></div>",没收到，东西，我想知道寄哪里去了,【玄彬同款】水润面膜,2021-02-08 00:46,,,,
****y,,"<div class=""comment-star star1""></div>",胶纸都被撕开了，我想不是快递能做到的，这样的产品能放心么？一打开就是这样,,,2018-05-07 22:11,水润保湿面膜10片,,
****a,,"<div class=""comment-star star1""></div>",买完之后才知道在**旗舰店和这个一模一样的才99元。,【补水保湿】水润面膜,2020-12-05 18:49,,,,
茹***n,PLUS会员,"<div class=""comment-star star1""></div>",帮朋友买的，可是朋友用了之后脸上起了红点，算了，以后绝对不会再到这里买了?,水润保湿面膜10片,2017-01-12 09:50,,,,
1***p,PLUS会员,"<div class=""comment-star star1""></div>",很好很好很好，一直用这个牌子，价格不贵值得推荐,水润保湿面膜10片,2018-08-06 08:59,,,,
小***豆,PLUS会员,"<div class=""comment-star star1""></div>",第一次在京东购买，刚收到货，就便宜了10块，两件便宜18块。不开心。,水润保湿面膜10片,2017-04-13 12:44,,,,
****5,PLUS会员,"<div class=""comment-star star1""></div>",为什么包装不一样，也没有贴防伪标志，以前买的都有防伪标志,水润保湿面膜10片,2017-04-25 22:49,,,,
****y,,"<div class=""comment-star star1""></div>",没有精华，干巴巴的，一点也不好用。,【热销爆款】水润保湿面膜,2020-06-24 21:37,,,,
奥***特,,"<div class=""comment-star star1""></div>",收到东西，为什么每盒都被拆开了？是有什么猫腻吗？,,,,【热销爆款】水润保湿面膜10片,2019-12-25 12:43,
快***种,,"<div class=""comment-star star1""></div>",拿一张用面膜好厚，没前几次买的蒲该不会是假的呀,水润保湿面膜10片,2018-05-22 06:40,,,,
****d,,"<div class=""comment-star star1""></div>",怎么感觉像假的呢！补水效果不好和之前买的不一样,【热销爆款】水润保湿面膜,,,,,2019-11-18 00:21
s***0,PLUS会员,"<div class=""comment-star star1""></div>",面膜是假的～跟韩国带回的真的对比过……好失望，一直很信任京东的,水润保湿面膜10片,2017-11-06 14:41,,,,
u***6,PLUS会员,"<div class=""comment-star star1""></div>",贴合度一般，效果一般，不如国产的某些牌子,水润保湿面膜,,,,,2019-05-29 13:42
u***v,,"<div class=""comment-star star1""></div>",使用几贴效果不是很好不联系大家买这个,水润保湿面膜10片,2016-11-14 12:28,,,,
****c,,"<div class=""comment-star star1""></div>",宣传有的赠品，没想到怎么找客服都找不到，虚假宣传,【玄彬同款】水润面膜,2020-12-27 14:12,,,,
c***u,PLUS会员,"<div class=""comment-star star1""></div>",一个简单的袋子，装了几盒被压扁的面膜，盒子完全破掉，我都不知道东西是不是真的,,,2018-04-24 08:57,水润保湿面膜10片,,
****2,,"<div class=""comment-star star1""></div>",一贴就完了，第二天早上满脸小痘痘，可怕,水润保湿面膜,,,,,2018-11-24 12:00
宁***1,,"<div class=""comment-star star1""></div>",第一次买和第二次买完全不一样，精华少好多。上当了。,水润保湿面膜10片,2016-09-21 17:38,,,,
于***索,PLUS会员,"<div class=""comment-star star1""></div>",不知道是不是真的，用了皮肤出红斑了。,水润保湿面膜10片,2016-09-11 23:07,,,,
S***e,,"<div class=""comment-star star1""></div>",和以前用的不一样，面膜水很少。,水润保湿面膜,,,,,2019-10-08 22:01
D***_,PLUS会员,"<div class=""comment-star star1""></div>",打算送人包装竟然这样的，而且不是快递原因，更像是人为造成，真次,,,2017-01-06 20:31,水润保湿面膜10片,,
****i,,"<div class=""comment-star star1""></div>",比之前的面膜后来很多，不贴合，不知道真假,水润保湿面膜,,,,,2019-04-16 07:40
****e,,"<div class=""comment-star star1""></div>",用了之后过敏，脸了起了好多红疹。,,,2020-11-11 12:19,【补水保湿】水润面膜,,
君***竹,,"<div class=""comment-star star1""></div>",买完没有两天就降价！降价幅度还这么多！京东是随心情定价的？,水润保湿面膜10片,2017-06-10 08:03,,,,
u***z,,"<div class=""comment-star star1""></div>",用后脸上过敏，红红的火辣辣的疼越用越干,水润保湿面膜10片,2018-04-30 21:53,,,,
u***f,,"<div class=""comment-star star1""></div>",面膜一般，感觉上当了，一点都不好用，,水润保湿面膜10片,2017-06-20 09:34,,,,
F***3,,"<div class=""comment-star star1""></div>",东西是不错，但为什么我拍的产品跟收到的产品不是一个牌子？谁能给我个解释！,水润保湿面膜10片,2017-11-14 09:06,,,,
****b,,"<div class=""comment-star star1""></div>",面膜纸好厚好厚根本没以前好用，用了闷痘,水润保湿面膜10片,2018-09-13 10:56,,,,
m***3,,"<div class=""comment-star star1""></div>",包装都破了，面膜都出来了，看了下没少，是十片我忍了,水润保湿面膜,,,,,2018-11-13 11:14
魂***a,,"<div class=""comment-star star1""></div>",一星给质量，但是第一天买完第二天就降价还不给补差价属实有点瓜皮了吧？,【热销爆款】水润保湿面膜,,,,,2019-11-14 01:42
小***-,PLUS会员,"<div class=""comment-star star1""></div>",没有胶原蛋白那个好用。。以后用黄色那种。,,,,水润保湿面膜,2018-11-15 09:08,
****c,,"<div class=""comment-star star1""></div>",一般般，一分钱一分货,水润保湿面膜10片,2016-12-28 12:20,,,,
塔***7,,"<div class=""comment-star star1""></div>",不知道为什么卖假货？,水润保湿面膜10片,2016-07-26 21:00,,,,
G***N,PLUS会员,"<div class=""comment-star star1""></div>",明明是三盒，只给我发了两盒，问客服也不回话，与我在香港买的有差别。,水润保湿面膜10片,2017-06-20 07:43,,,,
8***可,,"<div class=""comment-star star1""></div>",被人拆过了，盒子烂货,水润保湿面膜10片,2017-11-14 10:25,,,,
可***乐,,"<div class=""comment-star star1""></div>",刚开始用用完脸有些红，后来就好了,【玄彬同款】水润面膜,2021-03-03 08:44,,,,
响***啦,PLUS会员,"<div class=""comment-star star1""></div>",刚刚收到，包装都破了,,,2017-12-07 14:07,水润保湿面膜10片,,
****v,,"<div class=""comment-star star1""></div>",今天刚到刚打开盒子就被人拆过京东现在也这样了吗,,,,【热销爆款】水润保湿面膜10片,2019-12-14 01:42,
欧***鳶,,"<div class=""comment-star star1""></div>",刚买就降价？逗我玩呢？,水润保湿面膜10片,2016-07-29 22:01,,,,
众***兮,PLUS会员,"<div class=""comment-star star1""></div>",只能说不是真品，盗版,水润保湿面膜10片,2017-09-28 17:20,,,,
****5,,"<div class=""comment-star star1""></div>",包装真差，到手就烂了,水润保湿面膜10片,2018-06-13 21:40,,,,
l***t,PLUS会员,"<div class=""comment-star star1""></div>",不像真的盒子都破了,水润保湿面膜10片,2018-04-19 00:04,,,,
****e,,"<div class=""comment-star star1""></div>",不好用感觉像假的一样一点不补水,【玄彬同款】水润面膜,2021-02-04 19:11,,,,
企***信,,"<div class=""comment-star star1""></div>",用过起痘痘一家都用了，都起痘痘,【热销爆款】水润保湿面膜,2020-07-09 10:37,,,,
b***d,,"<div class=""comment-star star1""></div>",拆开过，包装也不好。,水润保湿面膜10片,2018-08-16 14:52,,,,
1***p,,"<div class=""comment-star star1""></div>",包装都破了，都拆开了！,水润保湿面膜10片,,,,,
是***货,PLUS会员,"<div class=""comment-star star1""></div>",包装盒封条全打开了。,水润保湿面膜10片,2017-11-22 20:38,,,,
****T,,"<div class=""comment-star star1""></div>",为什么给打开了，你们有职责道德吗？,,,2021-01-31 19:18,【玄彬同款】水润面膜,,
幼***熊,PLUS会员,"<div class=""comment-star star1""></div>",不像正品，*越来越完蛋,水润保湿面膜10片,2017-09-05 19:12,,,,
u***t,PLUS会员,"<div class=""comment-star star1""></div>",邮过来包装都碎了。。。,水润保湿面膜10片,2016-09-11 15:52,,,,
C***8,PLUS会员,"<div class=""comment-star star1""></div>",这次一打开盒子都是烂的，买了4盒，每个盒子都是开的不知道什么原因，,水润保湿面膜10片,2018-04-06 08:55,,,,
C***6,,"<div class=""comment-star star1""></div>",拿到手，包装完全坏了，而且扫描二维码扫不出来正品。,水润保湿面膜10片,2018-02-13 08:52,,,,
b***n,PLUS会员,"<div class=""comment-star star1""></div>",老婆说这次用后有颗粒物，感觉没有以前好，不像正品。,,,2018-06-17 14:15,水润保湿面膜10片,,
u***m,,"<div class=""comment-star star1""></div>",太厚了，感觉不是正品,水润保湿面膜,,,,,2019-01-22 00:32
枫***流,PLUS会员,"<div class=""comment-star star1""></div>",包装不好，压的严重变形，以前有纸盒装，现再就直接用塑料袋包装。,水润保湿面膜10片,2018-07-10 18:32,,,,
七***Y,,"<div class=""comment-star star1""></div>",不好用用了起痘痘面膜纸太厚,水润保湿面膜10片,2017-09-20 21:22,,,,
s***4,PLUS会员,"<div class=""comment-star star1""></div>",盒子已经破损开口了。,,,,水润保湿面膜,2019-07-01 18:55,
****P,,"<div class=""comment-star star1""></div>",速度确实快，京东小哥态度也很好。就是我好好的包装为什么能成这样？,,,2016-10-27 12:45,水润保湿面膜10片,,
K***Q,,"<div class=""comment-star star1""></div>",怎么连珠光膜也没有确定是正品吗用着一般,水润保湿面膜10片,,,,,
我***1,,"<div class=""comment-star star1""></div>",产品质感：很硬补水效果：不好，贴合效果：不贴合,【热销爆款】水润保湿面膜,2020-07-19 09:38,,,,
2***a,,"<div class=""comment-star star1""></div>",收到货是被拆开的？？？,,,,水润保湿面膜,2018-11-11 17:40,
****l,,"<div class=""comment-star star1""></div>",从敷的效果和敷的过程出现的情况看产品貌似不真,水润保湿面膜10片,2018-09-20 09:43,,,,
2***蛋,,"<div class=""comment-star star1""></div>",包装是老款，不是新款的，用起来感觉不一样,水润保湿面膜10片,2017-08-20 11:51,,,,
w***4,PLUS会员,"<div class=""comment-star star1""></div>",使用感受：用后脸有刺痛感，应该是假货，不建议大家买,【热销爆款】水润保湿面膜10片,,,,,2020-05-30 23:47
****I,,"<div class=""comment-star star1""></div>",不知道为什么晚上贴一张第二天准起痘。,【热销爆款】水润保湿面膜,,,,,2019-10-28 13:59
****e,PLUS会员,"<div class=""comment-star star1""></div>",不是很好用。我用完之后脸上反而起皮了,【热销爆款】水润保湿面膜10片,,,,,2020-02-20 18:21
****1,PLUS会员,"<div class=""comment-star star1""></div>",东西一般，价格和价值太大偏离。没多大用，买来没用丢着,水润保湿面膜10片,2017-09-10 11:55,,,,
s***2,,"<div class=""comment-star star1""></div>",刚买了几天就降价！！！！,水润保湿面膜10片,2018-01-09 10:42,,,,
****e,,"<div class=""comment-star star1""></div>",辣鸡包装都被开过了,,,,水润保湿面膜,2019-06-27 22:52,
****。,PLUS会员,"<div class=""comment-star star1""></div>",不咋行，有点刺激，扔了，应该是有可能不适合我吧,【补水保湿】水润面膜,2020-08-31 08:52,,,,
辉***轩,,"<div class=""comment-star star1""></div>",盒子是烂的假货,,,2018-03-10 13:39,水润保湿面膜10片,,
o***阳,PLUS会员,"<div class=""comment-star star1""></div>",包装破损，服务态度差,水润保湿面膜10片,2018-01-23 21:50,,,,
哆***f,,"<div class=""comment-star star1""></div>",实物和图片有差距，实物上面没有那个x3,,,2016-12-16 23:11,水润保湿面膜10片,,
C***0,PLUS会员,"<div class=""comment-star star1""></div>",盒子是被人拆过的，还写着套装勿拆，我也是醉了，再也不敢上网买面膜了,,,2017-11-15 22:51,水润保湿面膜10片,,
王***6,,"<div class=""comment-star star1""></div>",三倍补水，连精华液都没有，怎么补水,【玄彬同款】水润面膜,2020-12-16 21:49,,,,
****x,,"<div class=""comment-star star1""></div>",假货泛滥跟之前专柜买的不一样，果然便宜没好货,【玄彬同款】水润面膜,2021-04-05 18:53,,,,
小***0,,"<div class=""comment-star star1""></div>",晕死，刚收到货，竟然降价50块，有没有搞错,水润保湿面膜10片,2018-06-01 21:19,,,,
剑***5,,"<div class=""comment-star star1""></div>",已经被拆了，看到别的买家说还不相信，原来京东也是不可靠的,,,2016-06-22 20:40,针剂水库补水保湿面膜25ml*10,,
u***l,,"<div class=""comment-star star1""></div>",一盒里面竟然不是十贴装，少一贴，气人,【玄彬同款】水润面膜,2021-01-24 14:49,,,,
S***e,,"<div class=""comment-star star1""></div>",我只想问一下为什么我买了8盒只给了一盒是什么意思,,,2020-06-19 21:08,【热销爆款】水润保湿面膜,,
****m,PLUS会员,"<div class=""comment-star star1""></div>",有效期过了三分之二还发货？双11变成清库存了。,,,2020-11-11 16:21,【补水保湿】水润面膜,,
****U,,"<div class=""comment-star star1""></div>",贴完脸上都长红疙瘩，假货吧以前用都没有这种情况,,,,水润保湿面膜,2019-06-01 09:26,
1***p,,"<div class=""comment-star star1""></div>",不知道是不是正品跟我以前买的不一样。而且精华液少,水润保湿面膜,,,,,2019-09-21 19:59
珺***呢,,"<div class=""comment-star star1""></div>",买了八盒，发了一盒，说补发，等了十天，七盒依然没有看到,【热销爆款】水润保湿面膜,2020-06-28 11:08,,,,
u***t,,"<div class=""comment-star star1""></div>",为什么包装盒又烂了，还是湿湿的，上次买也是这样的。,水润保湿面膜10片,2017-04-19 13:51,,,,
****e,,"<div class=""comment-star star1""></div>",不是正品不要上当了,水润保湿面膜,,,,,2019-10-13 23:21
u***7,,"<div class=""comment-star star1""></div>",应该是假的，跟我在免税店买的不一样，面膜纸都有区别,水润保湿面膜10片,2018-03-09 20:25,,,,
****i,,"<div class=""comment-star star1""></div>",我感觉不是正品，和我以前买的不一样，没以前买的好用,水润保湿面膜10片,2017-11-15 18:12,,,,
****6,,"<div class=""comment-star star1""></div>",不是丝质的，比丝质的厚好多，让人有点怀疑是不是假货,水润保湿面膜10片,2016-12-16 05:33,,,,
****U,,"<div class=""comment-star star1""></div>",玛德，刚买就对折…,水润保湿面膜10片,2016-12-21 01:01,,,,
段***坤,,"<div class=""comment-star star1""></div>",肯定是假的和朋友从韩国带回来的感觉完全不一样,水润保湿面膜10片,2017-10-17 22:34,,,,
K***o,,"<div class=""comment-star star1""></div>",跟从韩国买回来的不一样，敷完以后脸上有红点,水润保湿面膜10片,2016-11-03 11:36,,,,
u***t,PLUS会员,"<div class=""comment-star star1""></div>",这样的包装也是醉了，怀疑是原包装拆开后再放进的面膜片，也不知道真假,,,,水润保湿面膜10片,,
u***r,,"<div class=""comment-star star1""></div>",完全没得精华，特别干燥，不知道好评都是怎么来的,【热销爆款】水润保湿面膜,2020-07-12 22:29,,,,
昀***忄,PLUS会员,"<div class=""comment-star star1""></div>",产品质感：粗糙补水效果：差贴合效果：差使用感受：用完皮肤痒,水润保湿面膜,,,,,2019-10-05 22:16
二***木,,"<div class=""comment-star star1""></div>",水分好少，用后皮肤很干，毛孔都变粗了，好郁闷,水润保湿面膜,,,,,2019-03-30 08:13
u***q,,"<div class=""comment-star star1""></div>",一点也不好用，不补水，精华液也少,【热销爆款】水润保湿面膜10片,,,,,2020-05-17 10:16
d***1,PLUS会员,"<div class=""comment-star star1""></div>",还没用，看样子还可以,水润保湿面膜10片,2016-08-12 12:35,,,,
****8,,"<div class=""comment-star star1""></div>",除了厚，别的都还可以,水润保湿面膜10片,2016-08-21 08:38,,,,
丹***1,PLUS会员,"<div class=""comment-star star1""></div>",用了过后脸又红又肿了，再不敢用了。,,,2017-11-15 15:05,水润保湿面膜10片,,
****o,,"<div class=""comment-star star1""></div>",感觉补水效果一般吧，没有什么明显效果。,【热销爆款】水润保湿面膜10片,,,,,2020-05-03 09:02
